type,name,address,lat,lng,open_day,close_day,open_time,close_time
0,柏市役所本庁舎1階ロビー,千葉県柏市柏5丁目10-1,35.8676559216851,139.97584523337335,2022/06/23,2022/07/09,8:30,20:00
0,沼南庁舎2階市民交流サロン,千葉県柏市大島田48-1,35.84154244966662,140.00770832888543,2022/06/23,2022/07/09,8:30,20:00
0,パレット柏（DayOneタワー3階）,千葉県柏市柏1丁目4-7,35.860414622876334,139.97221813334815,2022/07/02,2022/07/09,8:30,20:00
0,リフレッシュプラザ柏,千葉県柏市南増尾58-3,35.81713233021607,139.97311400451127,2022/07/02,2022/07/09,9:00,20:00
0,ららぽーと柏の葉北館3階 キッズプレイエリア,千葉県柏市若柴175,35.89492009925371,139.9516249028291,2022/07/02,2022/07/09,10:00,20:00
0,イオンモール柏3階ノースブリッジ,千葉県柏市豊町2-5-25,35.85169152431353,139.96172653334784,2022/07/02,2022/07/09,10:00,20:00
0,モラージュ柏2階モラージュホール,千葉県柏市大山台2-3,35.88192085812013,139.9692916263387,2022/07/02,2022/07/09,10:00,20:00
0,田中近隣センター 体育室,千葉県柏市大室249-1,35.90392374214406,139.95883944274914,2022/07/07,2022/07/09,8:30,17:00
0,高柳近隣センター 多目的ホール,千葉県柏市高柳1652-10,35.81122410448767,139.99824695118483,2022/07/07,2022/07/09,8:30,17:00